{
  "$schema": "https://json-schema.org/draft/2020-12/schema",
  "$id": "https://chw-navigator.org/schema/gen8/external-effect-catalog/1.0.0",
  "title": "Approved external-effect planning catalog",
  "type": "object",
  "required": ["id", "version", "templates", "policies", "adapters"],
  "properties": {
    "id": {"type": "string", "minLength": 1},
    "version": {"type": "string", "minLength": 1},
    "templates": {"type": "array", "items": {"type": "object"}},
    "policies": {"type": "array", "items": {"type": "object"}},
    "adapters": {"type": "array", "items": {"type": "object"}}
  },
  "additionalProperties": false
}
